{
  "verbosity": "detailed",
  "focusAreas": [
    "functionality",
    "security",
    "performance",
    "readability"
  ],
  "outputFormat": "inline",
  "maxTokens": 4000,
  "maxDiffSize": 100000,
  "highlightIssues": true,
  "includeSuggestions": true,
  "includeSummary": true,
  "model": "claude-3-opus-20240229",
  "temperature": 0.7,
  "preferCli": true
}
